Title;Author(s);Year;Master Track;Supervisor;Second reader;Abstract/Summary;Main Research Question;SDG;Justification for SDG;Geographical scope;Scale;Main sector;Keywords;Methodology Type;Specific Methods;Theories;Internship Organization;Organizations Studied;Geographical location standardized;Latitude;Longitude;Location precision;Flag
AGENT-BASED MODELLING OF THE HOUSE SPARROWS DESIGNING A SPATIAL BEHAVIOURAL MODEL FOR THE HOUSE SPARROW IN ZAANDAM;Maartje van Heck;2022;Environmental Change and Ecosystems;Stefan Dekker, Belinda Kater;Natalie Davis;The loss of biodiversity is a global problem, with a significant decline in house sparrows in north-western Europe, including the Netherlands. This research aims to explore the behavior and distribution of house sparrows using a conceptual behavioral model to predict their spatial distribution. An agent-based model was developed in Netlogo, resulting in various pathways for house sparrow distribution. Pathways 1 and 3 yielded the best results, while the standard pathway and pathway 4 performed poorly. The model shows that the suitability of houses greatly influences house sparrow distribution, although it does not fully align with real-world observations, indicating the need for further research.;;15 - Life on Land;This SDG applies as the research focuses on the conservation of house sparrows, which are affected by biodiversity loss.;Zaandam, Netherlands;Local;Ecology & Biodiversity;;Conceptual & Theoretical, Mixed Methods Research;Agent-Based model;;Arcadis;;Zaandam;52.4424926;4.8298607;City;Missing Research Question
Uncovering Landscapes of Vulnerability;Frank Prins;2022;International Development;Dr. Andres Verzijl;Dr. ir. Janwillem Liebrand;Indian coastal deltas, such as the Cauvery and Godavari Delta, consist of the world’s critical disaster risk hotspots. An important dimension of disaster risk is the societal conditions of vulnerability, consisting of the capacity to anticipate, cope with, resist, and recover from the impacts of a natural hazard. Vulnerability denotes a multidimensional concept encompassing many social, economic, political, and cultural conditions that differ through time and space. This research provides the first assessment of vulnerability in the Cauvery and Godavari Delta, as it aims to uncover the spatial and temporal dynamics of vulnerability in the two deltas. For this research, the Indian Delta Vulnerability Index was developed to measure and map the multidimensional level of vulnerability using secondary government data from 2011. Furthermore, a literature study and local expert consultations were used to better understand the spatial and temporal production of vulnerability. Three main conclusions emerge. First, a cross-delta vulnerability gradient was observed in both deltas, with the tail-end regions of the Cauvery and Godavari Deltas identified as significant vulnerability hotspots. Secondly, it was found that historical patterns of irrigation, agricultural productivity, marginalisation, and social differentiation shape the current vulnerability landscapes. Thirdly, the production of vulnerability was found to be shaped by complex spatial-temporal dynamics. Further comprehensive analysis across the two deltas is recommended to improve our understanding of the production and reproduction of the vulnerability landscapes.;;;;Cauvery and Godavari Delta, India;Local;Governance & Policy;Vulnerability, Spatiality, Temporality, Cauvery, Godavari, Delta, India;Qualitative Empirical Research;Literature study, local expert consultations;;;;India;22.3511148;78.6677428;Country;Missing Research Question, Missing SDG
Facilitation for the future: The Ozone Secretariat’s role during the Kigali Amendment negotiations;Jannah Wijermars;2022;Earth Systems Governance;Rakhyun Kim;Frank Biermann;The Kigali Amendment is the latest addition to the Montreal Protocol for Substances that Deplete the Ozone Layer. This Amendment ensures that HFCs are phased down under the Protocol’s regulations. The Ozone Secretariat has shown interest in phasing down HFCs directly after they were first discussed by some Parties. But why the Secretariat did so was puzzling. The research aims to answer why the Ozone Secretariat facilitated the Kigali Amendment negotiations. A hypothesis was built and tested through document analysis and qualitative interviews. The findings confirm the Secretariat had autonomy and influence, was eager to jump on HFCs, and their motivation was driven by a need for survival.;Why did the Ozone Secretariat facilitate the Kigali Amendment negotiations?;13 - Climate Action;The research addresses the role of the Ozone Secretariat in climate change mitigation through the Kigali Amendment, which is crucial for reducing greenhouse gas emissions.;Global;Global/International;Governance & Policy;Ozone Secretariat, Montreal Protocol, Kigali Amendment, HFCs, Survival, Problem-shifting;Qualitative Empirical Research;Document analysis, In-depth qualitative interviews;;;;;;;Broad;
History and belief coalitions in conservation conflict;Brian Reilly B.Sc.;2022;Earth Systems Governance;Hens Runhaar, Ine Dorresteijn;Marjanneke Vijge;This research addresses human-wildlife conflict (HWC) in the Western Carpathians, where increasing human population and land development lead to conflicts over wolf protection and wild boar management. The study aims to explore how historical developments influence stakeholder cooperation in conservation. Data were collected through in-person interviews with 21 stakeholders, and network analysis and qualitative content analysis were employed. Findings indicate that policy core beliefs are crucial for coalition formation, and historical narratives bridge separate coalitions. The research highlights the importance of social factors in conservation conflicts and suggests that understanding these dynamics can foster cooperation.;How do local historical developments influence stakeholder cooperation in the conservation and management of wolves and wild boar in the Western Carpathians?;15 - Life on Land;This SDG applies as the research focuses on wildlife conservation and the management of species in their natural habitats, addressing the challenges posed by human-wildlife conflicts.;Western Carpathians;Local;Ecology & Biodiversity;conservation conflict, historical context, beliefs, coalitions, cooperation network;Qualitative Empirical Research;In-person interviews, Network analysis, Qualitative content analysis;Advocacy Coalition Framework;;;;;;Broad;Abstract too short
Private Sector Involvement in Climate Adaptation;Alessa F. Zoetbrood;2022;;Peter Driessen;Carole-Anne Sénit;Climate change poses an increasing risk to human and natural systems, and climate action is necessary to reduce these risks. The mobilisation of private sector investment and adaptation is needed but remains difficult. A strategy to encourage private sector engagement is through public-private partnerships. However, public-private partnerships are not always effective, and private sector engagement is sometimes still low in public-private partnerships. This research aims to investigate the role and level of engagement of the private sector, and its linked justice implications in public-private partnerships focused on food security adaptation in the global South. This research has conducted a case study analysis with four public-private partnerships concerned with agricultural adaptation in the global South. This thesis shows that the private sector often plays a key role within the public-private partnerships and are responsible for the actual delivery of the program or project.;;;;Global;Global/International;Governance & Policy;Climate Adaptation, Public-Private Partnerships, Justice, Private Sector Involvement, Food Security and Agriculture;Qualitative Empirical Research;Case study, Interviews, Document analysis;;;;;;;Broad;Missing Research Question, Missing SDG
The impact of the photosynthetic traits’ downregulation on the leaf nutrient composition;Sophie Wynaendts;2022;Environmental Change and Ecosystems;Hugo de Boer;Karin Rebel;This research investigates the relationship between photosynthetic parameters and the nutrient composition of four plant species, focusing on nitrogen, phosphorus, and micronutrients such as zinc, iron, and calcium. The aim is to understand how atmospheric CO concentration affects these traits and nutrient content. A field study in the Ebro basin provided the plant material, and various statistical analyses were conducted to derive results. Findings indicate that increased CO leads to downregulation of photosynthetic traits, resulting in lower concentrations of leaf phosphorus and zinc. Further research is suggested to expand the analysis to other plant materials.;What is the relationship between the photosynthetic parameters and the nutrient composition of selected plant species?;2 - Zero Hunger;The research addresses the impact of climate change on nutrient deficiencies, which is crucial for tackling global malnutrition.;Ebro basin, Spain;Local;Ecology & Biodiversity;photosynthesis, nutrient composition, micronutrients, climate change, plant species;Quantitative Empirical Research;Statistical analysis, ANOVA, ANCOVA;;Royal DSM;;Ebro basin;;;Broad;Abstract too short
